{
	"id": "IdOfPointInterest",
	"type": "PointOfInterest",
	"name": "POI's name",
	"description": "POI's description",
	"address": {
		"postalCode":"06000",
		"addressLocality": "NICE",
		"addressRegion": "Alpes Maritimes",
		"addressCountry": "FR",
		"streetAddress": "455 Promenade des anglais"
	},
	"category": ["113"],
	"dateModified": "2017-09-25T09:04:26Z",
	"dateCreated": "2017-09-25T09:04:26Z",
	"location": {
		"type": "Point",
		"coordinates": [
			-8.768460000000001,
			42.60214472222222
			]
	},
	"source": "http://[SourceOfThePOI]",
	"refSeeAlso": ["IdOfTheReferencedDataModel","PointOfInterest-Accommodation-74564"]
}


