{
	"id": "POI-Parking-OBJ001",
	"type": "PointOfInterest",
	"name": "MASSENA",
	"description": "Description du parking de MASSENA",
	"address": {
		"postalCode":"06000",
		"addressLocality": "NICE",
		"addressRegion": "Alpes Maritimes",
		"addressCountry": "FR",
		"streetAddress": "18 Avenue Félix Faure"
	},
	"category": ["XXX, correspondant à Parking"],
	"dateCreated": "2017-09-25T09:04:26Z",
	"dateModified": "2017-11-07T14:18:58.00Z",
	"location": {
		"type": "Point",
		"coordinates": [
			7.26985643, 43.69770086
			]
	},
	"source": "http://[SourceOfThePOI]",
	"refSeeAlso": ["Parking-OBJ001"]
}


